{
  "schema_version": 2,
  "approval": {"status": "pending"},
  "packet_manifest_sha256": "0000000000000000000000000000000000000000000000000000000000000000",
  "candidate_map_sha256": "0000000000000000000000000000000000000000000000000000000000000000",
  "blind_reviews_sha256": "0000000000000000000000000000000000000000000000000000000000000000",
  "raw_observations_sha256": "0000000000000000000000000000000000000000000000000000000000000000",
  "candidate_run_digests": {},
  "cases": []
}
